,Question_Links,Views,Upvotes,Spaces,Questions,Answers
74,https://www.quora.com/How-do-I-overcome-the-language-barrier-in-a-job/answer/Kamal-Raj-17,8,–,www.quora.com,How-do-I-overcome-the-language-barrier-in-a-job,"(I am assuming that you know the language your colleagues use. Even if you don't know, the below answer greatly reduces the barrier)
Listen.
Listen without thinking to answer.
Listen with intention to clarify.
Listen with your eyes.
Finally ask for clarifying question before you answer.
When possible be kind to the other person and ask them whether they have any questions after you finish answering.
(Language barriers are reduced not by learning new languages to speak, but to listen to new friends, colleagues)
If you love talking, then best is learn programming languages and speak logically with computers and create software.
Not only your life but the entire world will be a better place."
77,https://www.quora.com/Why-is-machine-learning-useful-for-making-predictions-but-not-for-finding-causal-relationships/answer/Kamal-Raj-17,32,1,www.quora.com,Why-is-machine-learning-useful-for-making-predictions-but-not-for-finding-causal-relationships,"ML doesn't have all the data necessary to prove a causal relationship. ML can work only on data that is fed. It cannot create new data or experiment. Some flavours of Reinforced learning can do experiments and learn, it is still not methodical experimentation. Allow me to elaborate.
Causal relationships are like laws of this universe. Starting from newtons laws of motion, Laws of thermodynamics, Energy conservation laws.
We have an age old wisdom that is,
Correlation does not imply Causation.
To imply Causation, lot of parallel study in unrelated feilds will be required. The physical experiments, the theory behind the causation needs to be verified mathematically. Many such discoveries yeild noble prize. We should also remember the creativity and meticulous work of scientists in finding such causation. Even then, many findings in the past were just correlation.
Machine Learning is purely mathematical. The universe it works is very different from our reality. The number of dimensions in some ML problems can go in hundreds of dimensions. But they are conceptual dimensions. Not something you can physically see or feel.
With help of libraries written in programming languages that can handle huge data, the theory behind the Machine learning is abstracted. Thanks to object oriented programming, it is much easier to abstract the machinery. If not today ML will be in obscurity.
With machine learning a new law or causation cannot be discovered, but only learned. The causation will be learnt using equations, variables and their outputs. They cannot be proved using more mathematics. But the outputs will have sufficient accuracy so we can make decision or influence someone."
79,https://www.quora.com/Which-skill-do-I-have-to-learn-first-and-why-artificial-intelligence-or-data-science-I-dont-have-any-other-knowledge-about-them-even-I-am-also-week-in-programming/answer/Kamal-Raj-17,21,–,www.quora.com,Which-skill-do-I-have-to-learn-first-and-why-artificial-intelligence-or-data-science-I-dont-have-any-other-knowledge-about-them-even-I-am-also-week-in-programming,"AI and Data Science is one of the ways of solving problems in this world. Before there was Statistics. Statistics is very misleading when the data is not sufficient. You have countless books explaining how statistics can be misleading. AI and DS leverages on Statistics, and solves problems and does it so well. But do we need it??? You will find out, keep reading
If you need one skill to then it is Problem Solving. There are many aspects to problem solving.
AI and DS started flourishing because the data availability sky rocketed along with the Computational power. Consider the datapoint.
How can these 5 points determine whether the company will default on the loan? In past, there will be no way to find out, apart from lot of calculation, years of experience and finally taking risk and extending credit. Finally see if the company repays it. That was a problem to banks. Today, the problem is solved (atleast 97%), to an extent that it is possible to predict the default ahead of time.
The Key is PREDICT. AI and DS are used extensively to predict the outcomes. They are used to locate the correlations, that our naked eyes or paper pencil calculations cannot show. All you need is the creativity and intuition to predict what might happen next.
Programming, Math are just tools. If you can predict or if your intuition says something will happen, then you use programming to collect the data and math to work on the data to PROVE you are correct. This is a very powerful ability. Leaders and effective managers use data so skillfully to influence the world around them.
Visualise yourself sitting in a meeting with a potential partner, and he is sharing you the benefits of a investment Scheme. As he continues to explain, your intuition says is there some flaw in the investment opportunity. You are unable to find it out. What you do next? Go to Google and ask for reviews from other users, or directly ask for the pro and cons of the investment scheme. Here you are trying to predict what will happen if you choose the scheme. You solved the problem, correct?
If you want others also to solve the problem, or if you want to solve the same problem with different values, conditions, and time lines then you can automate the process by programming it. The steps you take manually can be programmed simply using any programming language, say python and execute the below PSEUDOCODE.
Each step above needs many steps, and many problems to solve. You have to imagine what you need as end result and walk back towards the current situation. Many things like programming, libraries, databases knowledge might be required, or you can hire someone to do it for you. Again, you can solve the problem that you have.
It is acceptable to be unaware of something and be weak in it. It is unacceptable to be weak after you know how to master a skill. All it takes to learn problem solving and programming is the passion to solve problems and create change in your own life and that of others.
There are so many free resources that is offered by many online Problem solving websites, that you can learn from. Many programming languages can be compiled on the websites. The data is available freely if you search in in Google. Change your mindset and start solving problems. Solve easy ones and gain confidence, then move to difficult ones. There are books which curate problems from easy to difficult levels. Search for them, and you will get it.
Have a great life and wonderful time learning to solve problems."
81,https://www.quora.com/Im-15-year-old-and-I-want-to-learn-computer-science-How-should-I-begin/answer/Kamal-Raj-17,151,1,www.quora.com,Im-15-year-old-and-I-want-to-learn-computer-science-How-should-I-begin,"Two points will be more important whether you pursue CS or any other engineering course.
Everything is about Logic. So solve lot of problems in your free time. Take a book that curates easy to difficult programs and start solving them. Most of the books will refer online judges. You can use the judge to chk your solution.
Learn one Programming Language, depending on the stream you choose.
For CS , IT guys Python/ Javascript. Electrical and Electronics start with Matlab and then Master assembly language. Mechanical and Civil it is Engineering drawing(language here is the geometries)"
82,https://www.quora.com/What-brands-and-companies-fail-because-they-dont-improve/answer/Kamal-Raj-17,37,–,www.quora.com,What-brands-and-companies-fail-because-they-dont-improve,"Companies fail because they are not managed well and the cash flow is not sufficient to stay afloat. Companies can sustain on their sales, and remain sthgnant without any improvement. Take some of our Kirana stores. They don't change muck. They are still around because they manage well"
84,https://www.quora.com/Im-confused-between-machine-learning-and-penetration-testing-even-though-I-love-both-careers-quite-much-but-I-cant-learn-more-than-one-skill-What-should-I-do-1/answer/Kamal-Raj-17,138,–,www.quora.com,Im-confused-between-machine-learning-and-penetration-testing-even-though-I-love-both-careers-quite-much-but-I-cant-learn-more-than-one-skill-What-should-I-do-1,"Pentest and ML both are about creativity and needs sound knowledge in programming. Instead of choosing the field choose the tool that is common in both the feilds, that is programming.
When you can code fluently, meaning you can get the output that you want from the computer fluently for number of problems, you can learn ML or Pentest easily.
Have a great career."
85,https://www.quora.com/What-should-I-major-in-to-launch-my-own-Machine-Consciousness-company-building-artificial-general-intelligence/answer/Kamal-Raj-17,55,–,www.quora.com,What-should-I-major-in-to-launch-my-own-Machine-Consciousness-company-building-artificial-general-intelligence,"Oh, you can come work for me, I already have the idea to create the AGI. Just kidding..OpenAI. Deepmind H2OAi are some companies already working on this route.
You need to major is physics, computer science and mathematics, specifically geared towards making emergent systems. That is just the start. Or you have to hire such people and pay them to work on creating the AGI. That is what Musk is doing, in Neuralink and OpenAi.
If you get to AGI,then you may have to let the AGI run your company… Hmm, interesting situation, rite? Think about it. Musk is alread fighting that such level of AI should not be created. Musk is a physics major too.
An AGI has to be connected with multiple AGI in order to show emergent behaviour. Then only AGI can become conscious. Because physicists have proved consciousness is a cause of an emergent system, our brain.
There are many books written on this topic. search for it in google. Then choose your career wisely."
86,https://www.quora.com/Why-do-you-believe-this-world-is-a-simulated-reality/answer/Kamal-Raj-17,127,–,www.quora.com,Why-do-you-believe-this-world-is-a-simulated-reality,"Nope, there will be lot more glitches in the simulated world for the level of complexity we are creating. Think this way. when a simulated world grows to level were that world can create its own simulation, then Recursion happens. Godel has written a lot on this idea. Take a look at his writings. Trippy, yet very gripping
With the advent of quantum computing, finding the matters that are why smaller that, a huge collider is required, the march towards metaverse, all these tech can help in creating a man made simulation. Which means, simulation inside the simulation. Recurrsion.
You must be aware of recurssion in programming, that is a function calling itself is a recursive function. If the argument given that function is very large then the system will run out of memory. If ours is a simulated world and we create a full fledged simulation, then there is possibility that our simulated beings to can create simulation. (Godel can be of help here, the math is complex). Then the main system running the program will run out of memory. And the designer of the system is lousy.
Lets assume a situation where an AI has already made paper clips out of the entire universe and a made a powerful computer to run simulations to gather data on something much bigger than this universe that this AI wants to control. Will the AI allow such recurrsion in its system, even accidentally. Will AI be a lousy programmer. Very less probability, that the null hypothesis can be safely rejected
So be assured, the world we live is not simulated. My views might change as the metaverse that many are touting really becomes simulated universe with creatures that can replicate itself by using the system resources differently, and there is a lot of “Deja vu” happening for lot more people then we might have to seriourly consider the possibility that we are just simulated beings.
What if you find out that you are a simulated being, what will you do next? Food for thought…"
87,https://www.quora.com/How-do-I-install-Pandas-on-Windows-11/answer/Kamal-Raj-17,22,1,www.quora.com,How-do-I-install-Pandas-on-Windows-11,There is only one way. Install Python distribution that supports Win 11 and then install pandas thru Pip. This is the simplest way too.
89,https://www.quora.com/Is-it-normal-for-beginners-to-get-stuck-on-a-problem-in-coding-for-more-than-2hrs-Would-you-recommend-still-trying-the-logic-or-just-look-at-logic/answer/Kamal-Raj-17,31,–,www.quora.com,Is-it-normal-for-beginners-to-get-stuck-on-a-problem-in-coding-for-more-than-2hrs-Would-you-recommend-still-trying-the-logic-or-just-look-at-logic,"I had the same dialemma and my strategy is to look at the logic after finding atleast 5 solutions, that I think might work but may not be correct.
When I say solutions, I need to come up with solution, code them and then find my answer is wrong. Like this 5 times if it happens, then I look at the logic. What I gain in that five times is more important.
After 5 different trials, if no correct solution then,
Here are some actions that can be taken to mitigate above challenges.
Misunderstanding the problem statement is very common. Nowadays, the online judges are having good descriptive questions, and sample cases for you to understand. So try honing your information gathering skill.
Not knowing the capabilities of the programming language, can arise due to forgetting the feature, or completely unaware of a feature. For example, in python there is a standard dict type that is part of python and default dict type that you can import from collections library.
This knowledge about defaultdict can greatly change the way you solve a problem. Start documenting the important functions, and programs and refer them regularly. Build your own Cheatsheet
Finally, solving a problems is series of decisions. When you chose a variable to be a integers, and list of integers can completely change how you access them. If your problem is designed for a list type and looping method, then doing it any other way might be tedious. Here again comes, documenting again but more detailed one.
You need full working programs to be documented. So learn Git, Github and store your programs there. Wherever you are, you must be able to get hold of the program that you want.
Most important use online judges and problems given there to train. There is still a challenge of which problems to start with. One of the judges I know have their own guide and hours of training session for free. That too online. All you need is spend time and learn.
Have a great time and all the very best."
91,https://www.quora.com/Even-after-so-many-wars-calamities-and-epidemics-why-do-humans-still-mindlessly-reproduce,145,N/A,www.quora.com,Even-after-so-many-wars-calamities-and-epidemics-why-do-humans-still-mindlessly-reproduce,"Human mind is making humans believe that it is they who are reproducing. It is the illusion created by the human mind and humans are living in illusion. For instance, in the infancy stage, humans don't have any urge to reproduce. Humans grow up without being aware of the sex hormones slowly taking over the control of their feelings and their mind. Then the uncontrollable urge causes discomfort in their bodies and in order to relieve themselves of that discomfort, the humans do the act of reproduction. Who is then driving humans to reproduce? It is the DNA residing inside the human body that is driving the body through urge to reproduce. It is the DNA that has built the body around itself for its purpose and made the body ignorant of DNA’s presence that is causing the body to think that it (i.e. the body) is controlling everything and taking action as per body’s own sweet will. Thus, the body and the mind are thinking and doing everything under illusion. So, the mind should shake off its illusion and think that it is the DNA inside it that is coercing it to reproduce and the mind should not give away easily itself to the DNA’s tantrums. Only then, the mindless reproduction will stop. In some people the DNA made errors while building their bodies and in such defective bodies, DNA is unable to cause the urge to reproduce and such people are liberated from the mindless reproduction. Remember Osho’s famous slogan, “If the child is beautiful, so is the act that produced it.”.








"
94,https://www.quora.com/Machine-have-less-problems-Id-like-to-be-a-machine-Wouldnt-you/answer/Kamal-Raj-17,11,–,www.quora.com,Machine-have-less-problems-Id-like-to-be-a-machine-Wouldnt-you,"If you really delve deep into Mechanics, Logic and Computer programming, you will realise even humans can be problem free.
The challenge is humans are Conscious and attract thoughts, ideas, and even events towards them. Machines on the other hand, can't do any of this. Forget about holding a belief like the one is embedded in your question.
I would suggest you to read a book called Bicentennial Man by Issac Asimov. Once you do that, see if you have a different idea about machines. Because, deep down we humans are just biological machines, developed and designed by nature/ universe. Just some Machine which acquired consciousness, belief system, and sophisticated brain and now thinking to reverse it and become Machine again.
IRony…"
95,https://www.quora.com/Can-Google-go-bankrupt/answer/Kamal-Raj-17,75,–,www.quora.com,Can-Google-go-bankrupt,"Google’s Rivals are Amazon, Facebook and Apple (Edit : I forgot to add the NLP AI models that are being created every moment now). Yep, they do have rivals, competitors or industry threats… Google’s major products are it Search, Android OS, Youtube service and their Keyword ad services. Lets make this analysis more interesting by doing the Porter’s 5 forces analysis
New entrant threats : MAAN companies and Googles IPs will make this threat non-existent
Substitituition : Search, Youtube and Android have costlier substitutes, so the risk is low. Amazon Search can be a good substituition though.
Buyers Bargaining Power: Limited power since the algorithms at Google consider the power and price the service accordingly
Sellers Bargaining Power: Google is horizontally and vertically integrated. Their major supplier are Software engineers, Government for land, sea and electricity. The Government can be a strong Seller, with immense Bargaining Power
Industry Rivalry : Rivalry among the MAANG will not be a news those following the media, reading books about these companies. These players, are very logical and leisez faire kind of Rivals.
Some additional snippets:
As of 2017 much of the search for the theoretical and knowledge oriented products were done on Google, while the real money to businesses that makes products depend on AMAZON. Product searches are done on Amazon directly.
If any of the MAAN companies become very big, and decide to take on the core “Search” product of Google, then Google may go bankrupt.
How Challenging can taking on just the Search product can be?
Search product and its algorithms, the pagerank, keyword auction, ad display algorithms are the back bone of the Behemoth called Google.
To addon, Google has hardware network in place to take their traffic to remote corners of the world, like the T1 lines, huge numbers of data centers, companies acquired which have both computing and networking prowess.
Search is integrated in the Android phones which may come in countless flavours, but these phones use google api, services in the backend and give back the data to the Queen bee (or King bee).
When I was thinking about the everything I do in my work, there is some involvement of Google. Unlike Amzn, FB or Apple, which are just “Good to have”, not a MUST HAVE. Google is a MUST HAVE.
Will the world of Searchers be ready to pay for their Search?
Worst calamity occurs, and Google is brought down to its knees. It is unable to deliver search results or youtube videos, or other countless services. They ask for the world of “Searcher” to give/ lend/ purchase share of 1$, (or denominations of that amount). Considering only the adults in this world, who are above 15 year of age, that amount to 5.9 Billion. They will get 5.9 Billion USD in less than 24 hours, and become afloat again.
The odds of google going under and then staying under is 1 in a hunderd trillion kind. In other words it is very unlikely. So stay calm, and keep searching. (I am telling this to myself too and keep my 1$ saved for Google).
Edit in Evening:
The odds of Google going Bankrupt or taken over has increased to 1 in billion kind
There is surprising Contender for Google Search Product, and that is Open AI’s GPT3. Anyone thinking about super charging your search, then better look at that AI model. It is amazing…."
96,https://www.quora.com/Ive-graduated-from-university-single-and-at-my-current-job-everyone-is-significantly-older-than-me-and-married-Where-should-I-look-to-find-a-date-partner/answer/Kamal-Raj-17,28,–,www.quora.com,Ive-graduated-from-university-single-and-at-my-current-job-everyone-is-significantly-older-than-me-and-married-Where-should-I-look-to-find-a-date-partner,"Never get emotionally involved with anyone at work.
Since you are new to the corporate world, stay away from anyone you might like in office, even they may be attractive and attracted to you.
Why? Work place is not for emotional attachment. It is place of vision, execution and effeciency. All these require Logic. If you are not fully invested then your mind won't work logically and creatively. The moment you bring attachment, your brain will seize up. Instead of being attached to the vision of the team or organisation,your brain will think about the person you are attached with. Your career will slow down, and if not careful, even END.
How? How to find a mate for a date? Simplest of the option, don't Search. Be attractive enough by mind and soul, your partner will come to you. Just do what you like the most, and there you will find your partner waiting. Think about it.
Not many go to work by liking it. In workplace you will find partners who are equally distracted and disoriented. You might find them physically attractive but get bored soon after you know them.
What next? Be greatful you have a workplace and monthly salary. Think about investing in yourself and get ready for a wonderful life. Think about going to cities, mountains that are beautiful and adventurous. Make plan for your dream home, that feeling of being in control over life. Read up. Read up as many books you want on any subject. Exercise and keep your body, brain and back strong, you will need it when your partner comes in your life.
Remember, you will attract exactly the people you want and think about. Be clear who you want, how they should be, what they look like and how will they treat you. You will be surprised. when they materialise in front of you and care for you. In that moment, make sure you decide wisely and stay with that partner for life. That is how your Mom and Dad stayed together. It works. Countless partners do this. Be pateint and continue doing what you like and love.
Be loved. love yourself, your day, your passion. Let your soul mate be attracted to you."
97,https://www.quora.com/IBMs-new-artificial-intelligence-can-simulate-the-real-world-What-are-your-thoughts/answer/Kamal-Raj-17,33,–,www.quora.com,IBMs-new-artificial-intelligence-can-simulate-the-real-world-What-are-your-thoughts,"There are many systems out there that can simulate and forecast the real world scenarios. Key point is what question are we trying to answer, or are we searching for the Question.
When you simulate the whole world then you will get lot more questions than answer to questions that you want. There is an Open AI project that simulates multiple worlds and advices the best economic policies, search youtube for the same. That model is simple compared to modeling the entire world. And it answers a crucial question.
AI simulations of the game worlds are itself very difficult because, the agent(the AI program) has limited visibility, and the feedback for Agent’s actions is delayed for long time. This is with Starcraft, a very complex strategy game. The game company have open sourced the game engine so any body can develop on top of it on github.
IBM can combine all these together and comeup with a complicated game kind of a platform. The more it is accessible to the world of hackers and prgrammers to play and get information from it, the more it will be useful. Else it will just be a game that no one played."
