,Question_Links,Views,Upvotes,Spaces,Questions,Answers
217,https://www.quora.com/What-categories-of-Mathematics-should-you-be-familiar-with-for-learning-Computer-Sciences-Deep-learning-and-Machine-Learning-Specialities/answer/Kamal-Raj-17,19,1,www.quora.com,What-categories-of-Mathematics-should-you-be-familiar-with-for-learning-Computer-Sciences-Deep-learning-and-Machine-Learning-Specialities,"There is a simple subject called Algebra that has powered the entire machine learning and AI revolution.
ax + b = c
It all starts with that simple equation. In case of machine learning. We know the “c”. The data. It is constant. Because it cannot be changed. It is there after collecting.
Then the differentiation, integration, matrix algebra, and optimization theory kicks in. You need not understand them to be a practitioner. If you know it is required, that is good.
If you apply for job then it is expected you know about them a bit deeper, like what really differentiation is, and how gradient descent works or some other algorithms. Even there you dont need to write the algorithms. This is what is required for daily work.
So start as a practitioner and then move to become expert. Problems algebra, differentiation can solve is very different from what machine learning with data can solve. And still use the base of algebra. Practice and then connect the dots."
218,https://www.quora.com/Can-AI-predict-absolutely-and-independently-without-being-fed-by-a-definite-set-of-programme-codes-by-a-programmer/answer/Kamal-Raj-17,46,1,www.quora.com,Can-AI-predict-absolutely-and-independently-without-being-fed-by-a-definite-set-of-programme-codes-by-a-programmer,"Nope. AI is not a being with agency. AI currently is something like the below picture.
So the AI cannot take any decisions currently without human aid. Still research going on for reaching level of sentience."
219,https://www.quora.com/Cant-we-just-screenshot-NFT-art-and-sell-it/answer/Kamal-Raj-17,41,–,www.quora.com,Cant-we-just-screenshot-NFT-art-and-sell-it,"To sell that screen shot you need to own it first. To say you own it, you need to register it on a Blockchain. That will cost you money, or crypto. Then you can sell it on the Blockchain.
Check out Open Sea. They offer the service to host your NFT. The point is to think how much you would be willing to spend for just “owning” it."
221,https://www.quora.com/What-is-the-best-path-as-a-career-among-Cyber-Security-Machine-learning-and-AI-software-development/answer/Kamal-Raj-17,94,–,www.quora.com,What-is-the-best-path-as-a-career-among-Cyber-Security-Machine-learning-and-AI-software-development,"Where do you think there is major demand for skilled professional is?
All these careers are currently taken up by almost everyone. Every other school friend is working at FAANG company. There has to be an edge, that you can leverage against the world, the organisations. There is a saying in Tamil, that roughly translates as follows.
In a land where there is no sugar the Mehua flower is Sugar. Where can your skills be used? That research must have lead you to quora the first place. Aspiring to be a cyber security or data scientist lies in not just about finding a job, but creating many jobs…. That could be an edge, which many entrepreneur do.
What is required now is to think of completely new professions altogether. Something very basic.
Ability to enter any field and master it at rapid pace. That seems to be great edge. My being an evangelist of mastery, advicing that, “Jack of all Trades” is an edge feels hypocritical. Things that we have to master has started to change.
Basic way we learn is getting altered by AI. It is no longer mandatory to master repetitive work through repetition. It can be programmed. Only the problem has to be looked from engineering and problem solving attitude. Any real world problem can be converted to algorithm or models now. That is very powerful.
Abstracting the working of ML, Cyber and SW Development is under rapid progress in AI field. Think about these professions, you can find frameworks, heuristics and certifications that one learns for years to master. All of these on top of undergraduate engineering course.
Really, is this necessary? Why to create such a burden on the children by making them study every subject under the universe and the make them feel bad when they arw unable to use it? Is the time spent is productive for our youth?
AI is making the career switching much easier, and frictionless in coming decade…. It doesn’t matter, whether you are developer or cyber hacker. You have to be conversant with how a computer thinks, a network moves data, AI learns from that data, and how marketing and product development fuels this entire cycles.
All this gives you a very different view of the world to thrive and have fun. Not just work and earn money."
222,https://www.quora.com/What-is-the-most-advanced-expression-of-AI-in-the-world-right-now-today/answer/Kamal-Raj-17,23,–,www.quora.com,What-is-the-most-advanced-expression-of-AI-in-the-world-right-now-today,"AI concept called Generative Adversarial network is the highest creative expression currently. Anyone can gin up the algorithm to create very interesting and dream like hallucinations.
Algorithms hallucinate and give out pictures.
In reality it is just mathematics made to work in complex ways to create such effects. Still it is very advanced expressions."
224,https://www.quora.com/What-is-the-difference-between-supervised-and-unsupervised-learning-and-how-can-we-tell-the-difference/answer/Kamal-Raj-17,81,–,www.quora.com,What-is-the-difference-between-supervised-and-unsupervised-learning-and-how-can-we-tell-the-difference,"It is all in the data. If the data is labeled and your model learns from that data, then it is supervised. If data is not labeled then it becomes Unsupervised Learning.
The idea is unsupervised learning can provide patterns that humans or the systems did not think about. This kind of learning can be very useful when there are more dimensions (features), especially in Computer Vision, Time series analysis and NLP.
Supervised learning models have their benefits too. The benefit is, we get “Free Products”. Take quora, a free product where you get the answer for many different questions. The data is created by users and it is labeled by them and shared to quora engineers. Who can make models out of it.
One question that the quora data can answer,
Who is most likely to answer the next question you have?
Quora can look at all the questions that one person has answered, and classify whether that person can answer your question using Natural Language processing models.
Even a simple regression analysis on, how many question one person has answered till date, can be used to forecast the future.
These types of questions and their answers make the product managers at quora to make the product more efficient and interesting to play with.
Keep exploring. You will see countless problems that can be placed under these two categories. Have a great time."
225,https://www.quora.com/Is-personal-computer-artificial-intelligence-AI/answer/Kamal-Raj-17,33,–,www.quora.com,Is-personal-computer-artificial-intelligence-AI,"Nope, the computer that work at your table and the one carry in your pocket is just slab of glass and plastic made from things like oil and sand.
They help only in “computing”. The intelligence that is famously spoken about, is basic algebra supercharged to include the features of real world. The models work kn these features, which can be as long as 500 to 1000 dimensions
Artificial super or general intelligence is different in one important sense. It can know which data it needs to solve the problem, and goes about Collecting it. This level is not reached yet.."
227,https://www.quora.com/What-is-the-easiest-way-to-control-over-thinking/answer/Kamal-Raj-17,12,–,www.quora.com,What-is-the-easiest-way-to-control-over-thinking,"Thinking has two roots. One in your body and other in your philosophy. To change the thinking then move your body to a different place, exercise or take a walk. Emotions, feelings and insecurity all arise with your body and brain.
Other option, work on the philosophy and find a new one. Take course on logic and philosophy for a change and get a fresh look at this world. It does change the entire life."
228,https://www.quora.com/I-have-to-choose-3-preferred-skill-sets-among-AI-ML-Data-Analytics-Cyber-Security-Cloud-and-Java-Full-Stack-for-joining-Wipro-Can-anyone-suggest-which-is-better/answer/Kamal-Raj-17,77,–,www.quora.com,I-have-to-choose-3-preferred-skill-sets-among-AI-ML-Data-Analytics-Cyber-Security-Cloud-and-Java-Full-Stack-for-joining-Wipro-Can-anyone-suggest-which-is-better,"Data Analystics,AI/ML and Cloud Stack would be the best to start a rewarding career. These fields are devoting huge researchers for advancement. So for these three."
230,https://www.quora.com/How-do-I-supercharge-Gmail-with-keyboard-shortcuts/answer/Kamal-Raj-17,26,–,www.quora.com,How-do-I-supercharge-Gmail-with-keyboard-shortcuts,"I have been using Gmail for work till date. One important thing to remember is, why you want to use short cuts. To me, I want to get rid of the mouse and use wireless keyboard. This saves tremendous time. Increased Efficiency is a good motivation but it is usually not sufficient.
I love to type. Yes, it is like how artist loves his brush. I love to type with only my right hand and use my left for doing some easy task like drinking tea while I type. It is possible with right hand Dvorak keyboard layout. There will be NO mouse near me. This is another way to force myself to learn shortcuts.
With this kind of setup, learning to use shortcuts on gmail is more than a necessity for me. I first learned the short cut keys by seeing the short cut help page for every action I need to do on gmail. The learning curve was pretty steep.
Once learned and my finger memorized the short cuts then it is breeze from that moment. Mostly I use mouse only when the gmail option doesn't have a shortcut for an action.
It is simple really if you have seen the hackers and uber programmers type. They use the key board like a pianist playing. The sound the keyboard makes will be mesmerising. This is possible with the inspiration and motivation.
Take it as a challenge to learn the shortcut and you will see opportunity every corner. Have a great day"
231,https://www.quora.com/If-someone-builds-a-MODEL-for-specific-problem-inwhich-this-model-learns-in-each-situation-and-does-not-require-retraining-anymore-by-the-AI-scientist-would-it-be-needed-by-the-companies-in-such-business-domain/answer/Kamal-Raj-17,39,1,www.quora.com,If-someone-builds-a-MODEL-for-specific-problem-inwhich-this-model-learns-in-each-situation-and-does-not-require-retraining-anymore-by-the-AI-scientist-would-it-be-needed-by-the-companies-in-such-business-domain,"Transfer learning.
In deep learning there is a concept called transfer learning where a model trained on a data can be used for classification of a entirely different data. The neural networks are modified by methodically Cutting certain parts of the model and retrain. This saves tremendous time and machine power.
Same way the model trained in a business can be used for different business with a bit of creativity. Usually the AI engineers prefer to build from the scratch. Use only the existing model in parts, but not in whole.
Take a look at this concept in Keras and Pytorch deep learning frameworks. It is very interesting to learn the idea behind it."
232,https://www.quora.com/Which-deep-learning-techniques-are-best-suited-for-sequential-data/answer/Kamal-Raj-17,30,–,www.quora.com,Which-deep-learning-techniques-are-best-suited-for-sequential-data,"LSTM and RNN are most suitable for sequential data. However the ARIMA and SARIMAX machine learning models give better predictions if hyper parameters are set with patience and knowledge.
FBProphet is very powerful machine learning algorithm which uses many heuristics that needs to be tweaked.
RNN are used in NLP too and language is the pervasive sequence that humans live and breath."
233,https://www.quora.com/How-do-I-make-a-bot-that-clicks/answer/Kamal-Raj-17,103,–,www.quora.com,How-do-I-make-a-bot-that-clicks,"Check out the RPA softwares like those made by the following companies
The software makes it simple to build complex bots that are very easy to make using gui interface. Very less programming is required
There are bots that mimic the action of clicking, that can be written in python. Appropriate libraries and sufficient time to learn should bring you up to speed fast enough.
A simple web search got me the above sites that can easily teach you how to get your mouse to click, without you lifting a twinkie. Take a look, enjoy programming."
235,https://www.quora.com/When-are-we-going-to-get-thinking-robots/answer/Kamal-Raj-17,18,–,www.quora.com,When-are-we-going-to-get-thinking-robots,"Reading the Robot series of Issac Asimov, left with a strong yearning to make a robot that can “Think” to begin with. When I completed the Foundation series, I understood why Elon Musk is very bullish about humans going to MARS.
During a lunch at office, topic of what we really want to become or create came up. I instinctively told, to make “Robots that Think”. All I got was blank stares from my colleagues. In fact, I was clueless on where to even begin.
I started training for the machine learning and python programming. I explored the ROS system that is predominant in building robot simulation. The search further lead to computer vision and AI systems. Forecasting techniques using the RNN, LSTM and other algorithms. None of the AI sounding algorithms were really “Intelligence”
So did I find the answer?
The answer was already known to me. I am a trained public speaker and influencer. Speakers believe that words carry lot more power than the pictures. Words can be used to program the minds. Even our self-talk can alter our state of thinking. I had known this all along, and did not think about Natural Language programming.
When I was losing hope in finding the key to thoughts, and thinking I was searching for some books on Natural Language Programming. One of the books hit the cord and resonated.
NLPIA has the introduction to NLP like no other. The authors have extensive experience, and tied the lose ends to the “Thinking” problem of the robots. In fact, there are so many scientists working with the same passion and vision. “To Make the Robots (bots) think”. MS already released “Tay”, an AI Bot which became very anti-social, and was taken down.
So we already have thinking bots. The robots wiill be around sooner than we expected. Musk’s Mars mission wiill be more interesting and science fiction worthy, when the flights are controlled by the “Thinking Robots”. Stay tuned and passionate."
236,https://www.quora.com/How-do-you-apply-to-give-your-face-and-voice-to-Russian-robots/answer/Kamal-Raj-17,6,–,www.quora.com,How-do-you-apply-to-give-your-face-and-voice-to-Russian-robots,"The company that got sued by Arnold for using his face without asking him has turned to the masses for
licensing “faces and voices”. The news article was citing that the application has been closed after 20,000 people volunteered.
Everyone needs to be unique. When such a licensing happens how the world would react is a unique social science experiment.
Keep a lookout for companies like, Tesla, boston dynamics might open up such application. There is work to be done if you are selected. Your 3D model of the face needs to be scanned.Voice needs to be recorded and analysed.
It is a new world. Lets be open to innovation"
237,https://www.quora.com/When-running-deep-neural-network-based-computer-vision-tumor-classification-on-H-E-stained-digital-pathology-images-is-there-a-preference-to-use-tissue-slides-vs-diagnostic-slides-or-would-you-use-both-at-the-same/answer/Kamal-Raj-17,17,1,www.quora.com,When-running-deep-neural-network-based-computer-vision-tumor-classification-on-H-E-stained-digital-pathology-images-is-there-a-preference-to-use-tissue-slides-vs-diagnostic-slides-or-would-you-use-both-at-the-same,"Question piqued my curiosity and checked the publication available out there.
What came to the top was rather surprising. The researchers are staining the slides, computationally. Which means they are not even using physical stains. The ability of the algorithms have become better at making the slides easier to read by the neural networks and find patterns
To answer your question, it is better to use the tissue slide itself directly. Later the computer does the staining. Good day."
238,https://www.quora.com/Is-perceptron-an-algorithm-in-a-neural-network-or-is-it-an-architecture-If-its-an-algorithm-is-the-Hebbian-rule-like-perceptron/answer/Kamal-Raj-17,89,1,www.quora.com,Is-perceptron-an-algorithm-in-a-neural-network-or-is-it-an-architecture-If-its-an-algorithm-is-the-Hebbian-rule-like-perceptron,"Perception is a program written in c language to aid the back propagation and feed forward learning of the model.
No it is not like hebbian rule. The neural networks back propagation algorithm uses activation function which seems very similar to synaptic activation. But they are not same.
Neurons in neural networks are not anywhere close to neurons."
240,https://www.quora.com/What-are-the-best-examples-of-advanced-AI-technology/answer/Kamal-Raj-17,108,–,www.quora.com,What-are-the-best-examples-of-advanced-AI-technology,"Beyond the superficial feeling that AI seems to do everything that humans can, the influence AI can have on the society is mind boggling.
The AI that can tweet, Tay. Heard of it? A botched experiment by MS. The bot Tay learnt from the tweets of its follower and started tweeting by itself. So what was the issue? Tay became antisocial. That is something we should really call advanced.
Then comes the dreaming AI. The google engineers decided to let the neural networks to learn the picture from imagenet(million pictures of many things). Then ran it through Generative adversarial networks (GAN) to find that the AI was churning out fantastic, dream like picture. One must follow the Google AI blog to get hold of many advances they continue to churn out..
There are countless other examples that work in financial industry. Like the loan default and fraud detection algorithms. They are paltry when compared to the bots that can chat with other bots on the internet to create massive sell off in asset markets.
The level of meta cognition the machine that are connecting and communicating increases, the wonders are going to increase. Keep your eyes and ears open…. Good. Day."
241,https://www.quora.com/I-focused-on-self-improvement-like-everyone-has-been-saying-but-I-m-still-sad-because-I-want-a-girlfriend-and-tired-of-doing-everything-in-life-alone-What-do-I-do/answer/Kamal-Raj-17,44,–,www.quora.com,I-focused-on-self-improvement-like-everyone-has-been-saying-but-I-m-still-sad-because-I-want-a-girlfriend-and-tired-of-doing-everything-in-life-alone-What-do-I-do,"You want company not girlfriend. You need to think self help as a pill that reduces pain not solution for your pain. Most importantly you need some spice in life. Bring a change of job, place, or city to begin with.
There will be something that you will love doing alone. Jogging, walking, programming, reading … anything. Find that. Then spend time doing that. Believe you are born to be great and achieve phenomenal things. Your soulmate might be right around the corner. Learn to attract her. Not run behind her. She will only runaway from you.
Searching for a girls or other companionship has lead many good guys to deep Trouble. Please be wary of that. People i know have had bad encounters in life when they went in search of relationships.
I have written this guidance from the advice I give to most of my friends. They too struggle with same problem that you have. I am glad you took muster and asked for help. Look around you, there are friends whom you never connected, places you love that you never visited recently. Jog your mind, and become creative.
These friends, places, food and things can give you new life. Be open and try. Have a great life."
243,https://www.quora.com/Is-it-worth-attending-TNABC-Miami-for-a-deep-learning-of-crypto-and-blockchain/answer/Kamal-Raj-17,12,–,www.quora.com,Is-it-worth-attending-TNABC-Miami-for-a-deep-learning-of-crypto-and-blockchain,"Deep learning and crypto have very different use cases. If one has to learn about deep learning, they better hard to Kaggle or sagemaker platforms. They provide the necessary courses and datasets. There is also communities that share information.
The datasets containing all the crypto NFT in Open Sea, the 10,000 crypto punks are available for you yo analyse. The entire 5 years trading data for major currencies are available. All this in Kaggle. So hands down, if you want to learn then head to these platforms rather tha n spending time and money on conference. Have a great future
Conferences are for selling, marketing and getting funding."
244,https://www.quora.com/Does-learning-data-structures-and-algorithms-help-me-to-code-faster-Faster-in-the-sense-help-to-come-up-with-a-quick-solution-while-working-on-a-real-time-problem/answer/Kamal-Raj-17,114,1,www.quora.com,Does-learning-data-structures-and-algorithms-help-me-to-code-faster-Faster-in-the-sense-help-to-come-up-with-a-quick-solution-while-working-on-a-real-time-problem,"Learning about the algorithms gives an edge gor sure, along with the data structure knowledge helps to use the algorithm correctly..
So learning both will boost your ability to program. With OOP concept and varied Framework that language use, the algorithm knowledge keeps you grounded. When you need to build a tool for solving a special challenge, you can begin with correct process.
Learn algorithm and data structure. You will do yourself a great favour."
246,https://www.quora.com/Does-reinforcement-learning-need-a-lot-of-data-like-supervised-or-deep-learning-does/answer/Kamal-Raj-17,390,–,www.quora.com,Does-reinforcement-learning-need-a-lot-of-data-like-supervised-or-deep-learning-does,"Reinforced learning is different from supervised or unsupervised learning fundamentally.
RL creates its own data by iterating over the problem space to find a way to reach the goal. Every iteration, the model learns something about the space. The model learns through the agent that navigate the space.
RL needs value and policy function that can help to learn better about the space. This is where much research is conducted currently. The learning can be done by machine learning or deep learning algorithm.
What is required, is a powerful machine that run iteration fast ."
248,https://www.quora.com/Why-can-t-we-know-exactly-how-some-artificial-intelligence-works/answer/Kamal-Raj-17,107,1,www.quora.com,Why-can-t-we-know-exactly-how-some-artificial-intelligence-works,"Lets rephrase the question, since the question seems to declare that AI is not understandable.
How can we exactly know, how AI works?
Answer is, By learning about how AI Learns. Get ready to enter the Rabbit Hole.
AI has been around for 50 years now. The back propagation idea along with the different type of activation functions that help the function to learn kick started the new era that we are in. (Which has lead to this question)
Idea is to create an algorithm that doesn't need the input to b..."
250,https://www.quora.com/How-do-I-prepare-myself-for-an-interview-with-a-computer-AI/answer/Kamal-Raj-17,18,–,www.quora.com,How-do-I-prepare-myself-for-an-interview-with-a-computer-AI,"Interview with AI can be very interesting. Your answer to a tech question might change you from a social media specialist to a game design analyst? That is how a Classification AI will work. So you will get a job, but may not be the one you applied for.
Every thing in AI is about features. With features comes classification and interpolation. Every thing about you will be a list of dimensions, and the answers that you give for the question, you guessed it, again they are list of dimensions.
AI that you see today in resume classification is very primitive. Those that take interviews can be real tricky, like playing a game. So being smart is very important and talking your way around AI can be fun too. How? There will be lot more opportunity for you to prepare for the interview by attending fake interviews with AIs. I am jumping ahead.
The AI that might interview you will be a mix of reinforced learning machine with some form of classification machine learning algorithms attached. Here you need to improve yourself in multiple dimensions and in each dimensions you need to skill yourself to multiple expertise levels.
Showing confidence in your expression, having relaxed attitude and can do perspective can add up to your success in interview. AI will take note of these dimensions too and factor it in the model it builds of your answers. The AI will be programmed to get the best model employee.
All the very best. You better be the best."
252,https://www.quora.com/What-is-the-best-artificial-and-machine-learning-online-course/answer/Kamal-Raj-17,63,–,www.quora.com,What-is-the-best-artificial-and-machine-learning-online-course,"The free course available online in Andrew ng's course in youtube and MIT computational thinking
Then you can visit Kaggle website for taking hands on programming course on python.
I chose the last option with lots of supplemental reading by myself using the free books available at http://zlib.com
.
Have a great time with your learning. Start with the intention to give back to the community. You will learn faster and become an expert soon."
